filename,title,year,document_type,primary_topics,policy_domain,geographic_scope,methodology,core_mechanisms,notes
ifs-homesforyoungfamiliesreportmarch2025 (1).pdf,Hom es for Young Families: A Pro -family Housing Agenda The Institute for Family Studies Wendell Cox Lyman Stone March 2025,2025,,,,,,,auto_seeded
ifs-homesforyoungfamiliesreportmarch2025.pdf,Hom es for Young Families: A Pro -family Housing Agenda The Institute for Family Studies Wendell Cox Lyman Stone March 2025,2025,,,,,,,auto_seeded
ifs-millennialsuccesssequence-final.pdf,"THE MILLENNIAL SUCCESS SEQUENCE Marriage, Kids, and the “Success Sequence” among Young Adults Wendy Wang and W. Bradford Wilcox",,,,,,,,needs_review
ifs-paidleavereport-final.pdf,ifs paidleavereport final,,,,,,,,needs_review
ifs-policy-brief-whitehouseaiactionplan (1).pdf,March 2025 Protecting the Family in the Age of Artificial Intelligence: 5 Recommendations for the White House’s AI Action Plan Michael Toscano Jared Hayde n,2025,,,,,,,auto_seeded
ifs-policy-brief-whitehouseaiactionplan.pdf,March 2025 Protecting the Family in the Age of Artificial Intelligence: 5 Recommendations for the White House’s AI Action Plan Michael Toscano Jared Hayde n,2025,,,,,,,auto_seeded
ifs-southerneuropereport-final-1.pdf,Is There Hope for Low Fertility? By Lyman Stone and Erin Wingerter May 2024“Demographic Rearmament” in Southern Europe,2024,,,,,,,auto_seeded
ifs-stateofcontradiction-final-1.pdf,"1 State of Contradiction: Progressive Family Culture, Traditional Family Structure in California Wendy Wang and W. Bradford WilcoxBy State of Contradiction: Progressive Family Culture, Traditional Family Structure in California",,,,,,,,needs_review
ifs-strongerfamilies-final-1-1.pdf,"Stronger Families, Safer Streets By Rafael A. Mangual, Brad Wilcox, Seth Cannon, and Joseph E. Price December 2023Exploring Links Between Family Structure and Crime",,,,,,,,needs_review
ifs-theartificialpoliticsofai-researchbrief2-january2026.pdf,January 2026 The Artificial Politics of Artificial Intelligence How U.S. Voters Feel About AI Accelerationism Michael Toscano Lyman Stone,2026,,,,,,,auto_seeded
ifs-wang-fatherstimebrief-oct2023-1.pdf,"American Dads Are More Involved Than Ever 1 © Copyright 2023 Institute for Family Studies. All rights reserved. AMERICAN DADS ARE MORE INVOLVED THAN EVER Especially College -Educated and Married Dads Wendy Wang October 24 , 2023",2023,,,,,,,auto_seeded
ifs-womenwork-nov2025-final2.pdf,More Married Mothers of Young Children Are Working Full Time The Institute for Family Studies Wendy Wang Jenet Erickson November 2025,2025,,,,,,,auto_seeded
ifs-workingclassreport-final-1-1.pdf,1 Working-Class Americans’ Views on Family Policy Working-Class Americans’ Views on Family Policy in collaboration with Patrick T. Brown By: September 2021,2021,,,,,,,auto_seeded
ifs-workismreport-final-031721.pdf,"1 More Work, Fewer Babies: What Does Workism Have to Do with Falling Fertility?Laurie DeRose and Lyman StoneBy: More Work, Fewer Babies: What Does W orkism Have to Do with Falling Fertility?",,,,,,,,needs_review
ifsaei-blackmenmakingit-2018.pdf,"Black Men Making It in America: The Engines of Economic Success for Black Men in America 1 BLACK MEN MAKING IT IN AMERICA: The Engines of Economic Success for Black Men in America W. Bradford Wilcox, Wendy R. Wang, and Ronald B. Mincy",,,,,,,,needs_review
ifsbrief-ai-relationships-november2024-1.pdf,November 2024 Artificial Intelligence and Relationships: 1 in 4 Young Adults Believe AI Partners Could Replace Real -life Romance Wendy Wang Michael Toscano,2024,,,,,,,auto_seeded
ifsbrief-eliminatemarriagepenalities-may2025.pdf,May 2025 How Congress Can Eliminate Marriage Penalties in the Tax Code and Safety -Net Programs Erik Randolph,2025,,,,,,,auto_seeded
ifsbrief-expand-the-child-tax-credit-2.pdf,"May 2025 Expand the Child Tax Credit Pronatal Policy Works , and America Can’t Afford to Forego It Lyman Stone",2025,,,,,,,auto_seeded
ifsbrief-iceland-marriedhouseholds-may2025.pdf,May 2025 Why Do Married-Couple Households Experience Fewer Household Hardships? John Iceland Joh Jaehoon Cho,2025,,,,,,,auto_seeded
ifsbrief-republican-marriage-advantage-oct24.pdf,"October 2024 The Republican Marriage Advantage Partisanship, Marriage, and Family Stability in the Trump Era Brad Wilcox Wendy Wang Sam Herrin",2024,,,,,,,auto_seeded
ifsbrief-zill-gradeinfationfamilystructure.pdf,"April 2025 Despite Grade Inflation, Family Structure Still Matters for Student Performance Nicholas Zill",2025,,,,,,,auto_seeded
ifscofjacksonvillereportfinal (1).pdf,Declining Divorce in Jacksonville: Did the Culture of Freedom Initiative Make a Difference? W. Bradford Wilcox University of Virginia Institute for Family Studies American Enterprise InstituteSpencer James Brigham Young UniversityWendy Wang Institute for Family Studies,,,,,,,,needs_review
ifscofjacksonvillereportfinal.pdf,Declining Divorce in Jacksonville: Did the Culture of Freedom Initiative Make a Difference? W. Bradford Wilcox University of Virginia Institute for Family Studies American Enterprise InstituteSpencer James Brigham Young UniversityWendy Wang Institute for Family Studies,,,,,,,,needs_review
ifseppc-tennesseebrief-2.pdf,"A Pro-Family Handbook for Tennessee 1 © Copyright 2023 Institute for Family Studies and Ethics and Public Policy Center. All rights reserved. A PRO-FAMILY HANDBOOK FOR TENNESSEE Patrick T. Brown October 2, 2023",2023,,,,,,,auto_seeded
ifsfathersdaybrief-june2024.pdf,"The Family -to-Prison -or-College Pipeline 1 © Copyright 2024 Institute for Family Studies and Gallup . All rights reserved. THE FAMILY -TO-PRISON -OR-COLLEGE PIPELINE: MARRIED FATHERS AND YOUNG MEN’S TRANSITION TO ADULTHOOD Brad Wilcox, Sam Herrin, Jesse Smith, & Wendy Wang June 2024",2024,,,,,,,auto_seeded
ifshousingfactsheet2.pdf,"The Future Is Family 513 E Main S t #1502 , Charlottesville , Virginia, 22902 434-326-7583 | michael@ifstudies.org www.ifstudies.org Homes For Young Families: Fact Sheet on Regulations, Affordability, and Family Formation Homes For Young Families: Fact Sheet on Regulations, Affordability, and Family Formation Our report, Homes for Young Families: A Pro -family Housing Agenda , present s evidence that local land -use regulations worsen housing affordability for young families. These regulations include: floor -area ratios set at very low levels, high parking requirements, height limits, and convoluted permitting processes. More Regulations, More Expensive Housing Stricter regulations are strongly correlated with worse affordability ratings. The most unaffordable cities are twice as heavily regulated as the most affordable cities. Less Affordable Housing Negatively Affects Family Formation • In the costliest thir d of cities, 34% of young adults live with their parents, while only 21% are married , and only 6% of women ages 20 -35 have had a baby in the prior year.",,,,,,,,needs_review
ifshousingfactsheet3.pdf,"The Future Is Family 513 E Main S t #1502 , Charlottesville , Virginia, 22902 434-326-7583 | michael@ifstudies.org www.ifstudies.org Homes For Young Families: Fact Sheet on Desired Housing Traits Homes For Young Families : Fact Sheet on Desired Housing Traits Housing is a core part of the family formation process, yet surprisingly little is known about what kinds of houses Americans want for their families. We remedy that gap in our recent report, Homes for Young Families: A Pro -family Housing Agenda , which presents evidence from a survey of nearly 9,000 Americans ages 18 -54. Americans Desire Space • When Americans envision their family life, the difference between 2 and 3 bedrooms is more important than: an extra 30 minutes of commute time, the difference between a townhouse and detached single -family home, any neighborhood amenity, and any size ya rd. • Even the differences between 3 and 4, or 4 and 5, bedrooms are more important than common variances in commute time, monthly housing costs, yard size, or neighborhood amenities.",,,,,,,,needs_review
ifshousingfactsheet5.pdf,"The Future Is Family 513 E Main S t #1502 , Charlottesville , Virginia, 22902 434-326-7583 | michael@ifstudies.org www.ifstudies.org Homes for Young Families: Fact Sheet on Safety, Crime, and Housing Homes for Young Families : Fact Sheet on Safety, Crime, and Housing For decades, o ne of the dominant trends in American housing geography has been suburbanization, which has always been associated with public narratives around crime. In Homes for Young Families: A Pro -family Housing Agenda , our survey of almost 9,000 Americans finds that safety is the single most important factor shaping the housing decisions of young families. No amount of affordability or amenities will ever be enough to convince a family that a neighborhood where they fe el unsafe is a great place to raise kids. Americans Value Safety and Low Crime Far Above Other Factors. • When asked to rank neighborhood traits in order of priority, survey respondents placed safety and low crime far ahead of any trait, and this was true for every demographic subgroup.",,,,,,,,needs_review
ifsmarriageandfertilityresearchbrief-wang-april2022-final.pdf,"Research Brief April 2022 No Honey, No Baby: The Relational and Economic Factors Associated With Having Children in America By: Wendy Wang The birth rate in the U.S. fell to a record low in 2020 amid the COVID -19 pandemic. On average, an American woman is expected to have about 1.6 children in her lifetime. This is well below the population replacement level (2.1 children per woman). The pand emic has also put a damper on people’s desire to have children, with more American adults ages 55 and younger saying their fertility desire has decreas ed since COVID -19. The downward trend for U.S. fertility started long before the pandemic. T he fertility rate hovered around the replacement level during most of 1990s and 2000s and started to drop in 2008, in the wake of the Great Recession. It has not returned to the pre-recession level since. Recent research by Melissa Kearney and colleagues suggests that demographic, economic, or policy changes have little to do with this decline. Meanwhile, the marriage rate in the U.S. also hit an all-time low . For every 1,000 unmarried adults in 2019, only 33 got married. The number was 48 just about two decades ago in 2000. The decline of marriage goes hand in hand with falling fertility rates, simply because married women have a much hi gher fertility rate than unmarried women. In 2020 , the birt h rate was 81 per 1,000 married women ages 15 -44, but just 39 per 1000 unmarried women of the same age. When fewer women are married, fewer babies are born. In fact, about half of the decline in fertility since 2008 can be attributed to changes in marital composition, according to an",2022,,,,,,,auto_seeded
ifsmemohousingfactsheet1.pdf,"The Future Is Family 513 E Main S t #1502 , Charlottesville , Virginia, 22902 434-326-7583 | michael@ifstudies.org www.ifstudies.org Homes for Young Families: Fact Sheet on Urban Growth Boundaries Homes for Young Families : Fact Sheet on Urban Growth Boundaries Our report, Homes for Young Families: A Pro -family Housing Agenda , highlight s one set of policies that imperil housing affordability: urban growth boundaries. UGBs are rules or policies setting hard limits about where land can be developed, with development beyond those limits requiring hard -to-get special exemptions or permissions . In some areas, UGBs are impenetrable barriers, while in others they simply increase development cost and restrict how much housing can be built on undeveloped land . UGBs Are a Major Source of Unaffordable Housing for Young Families • UGBs increase land prices near the boundary by 8 - to 20-fold, with sharp discontinuities near boundaries. • 19 of the 20 least -affordable housing markets have UGBs. On the other hand, none of the most affordable markets have documented UGBs. UGBs May Imperil the Types of Housing Young Families Want Most • By limiting the amount of land available, UGBs may incentivize developers to build more tower -developments with small apartments, instead of single -family homes that our report reveals to be the overwhelmingly desire of young Americans. Federal Land Ownership Sometimes Acts as UGBs • Many cities, especially in Western states, may not have an official UGB but are hemmed in by federal lands. • The government often retains agriculturally fallow, ecologically unexceptional, and recreationally unused lands on the fringes of developed areas and roadways for much longer than is reasonable.",,,,,,,,needs_review
ifsmemohousingfactsheet4.pdf,"The Future Is Family 513 E Main S t #1502 , Charlottesville , Virginia, 22902 434-326-7583 | michael@ifstudies.org www.ifstudies.org Homes For Young Families: Fact Sheet on Single-Family Homes Homes For Young Families: Fact Sheet on Single-Family Homes Today, apartments as a share of home construction are at their highest level in decades. This is concerning since, as we show in Homes for Young Families: A Pro -family Housing Agenda, almost nobody in America wants to raise a family in an apartment. Our survey of almost 9,000 Americans finds a broad -spectrum rejection of apartment living across every single demographic group surveyed. Americans Want Single -Family Homes • When asked to visualize their ideal home: 79% of respondents say detached SFH, even though only 59% are currently living in that kind of housing. • Detached SFH are the only housing type where the proportion of respondents identifying this as ideal exceeds the proportion living in these types of homes. Family Aspirations Shape Housing Desires • Respondents under age 35 in apartments average just 0.3 children, compared to about 0.6 children for those in other housing. Meanwhile, for respondents ages 35 to 54, apartment -dwellers average 1.3 children, vs. 1.6 for others.",,,,,,,,needs_review
ifsreport-workingclassmen-april2025.pdf,"Good Jobs, Strong Families: How the Character of Men’s Work is Linked to Their Family Status The Institute for Family Studies and Penn’s Program for Research on Religion and Urban Civil Society Grant Martsolf Brad Wilcox April 2025",2025,,,,,,,auto_seeded
ifsresearchbrief-clayroutledgefindingmeaning (1).pdf,"Research Brief May 2018 Meaning in Modern America by Clay Routledge Meaning is a fundamental psychological need. People who perceive their lives as full of meaning are physically and psychologically healthier than those who lack meaning. A lack of meaning is a risk factor for mental illness, suicide, and a wide range of unhealthy behaviors. When people are facing major life stressors and traumas, it is those who have a strong sense of purpose and meaning who are the most resilient. Individuals who view their lives as meaningful also live longer. In general, meaning motivates heathy, long-term goal pursuit and promotes psychological wellbeing.1 Relationships and religion have long been recognized as two particularly powerful sources of meaning in life. People who feel connected to and supported by others report greater meaning than those who feel disconnected, ostracized, or lonely.2 Experimental studies confirm this link by demonstrating that experiences of social exclusion decrease meaning3 whereas experiences that engender feelings of social support increase meaning.4 Concerning religion, believers and those who highly identify as religious tend to report greater perceptions of meaning than nonbelievers and those who believe but are not particularly religious.5 Religion has further been found to be a potent resource for defending against meaning threats; believers turn to their faith when confronted with situations that undermine a sense of meaning, and doing so helps protect psychological health.6 American culture is changing in a number of ways that have potentially powerful implications for people’s efforts to find and maintain meaning in life. Americans are waiting longer to get married and have children, and are having fewer children.7 Feelings of social disconnection and loneliness are on the rise, even as people are increasingly “connected” via social media.8 Americans are decreasingly religious both in terms of personal faith and 1 Hicks, J. & Routledge, C. (Eds) (2013). The experience of meaning in life: Classical perspectives, emerging themes, and controversies. New York: Springer Press. 2 Lambert, N. M., Stillman, T. F., Hicks, J. A., Kamble, S., Baumeister, R. F., & Fincham, F. D. (2013). To belong is to matter: Sense of belonging enhances meaning in life. Personality and Social Psychology Bulletin, 39, 1418-1427. 3 Stillman, T. F., Baumeister, R. F., Lambert, N. M., Crescioni, A., DeWall, N., Fincham, F. D. (2009). Alone and without purpose: Life loses meaning following social exclusion. Journal of Experimental Social Psychology, 45, 68-694. 4 Routledge C., Arndt, J., Wildschut, T., Sedikides, C., Hart, C., Juhl, J., Vingerhoets, A. J., & Scholtz, W. (2011). The past makes the present meaningful: Nostalgia as an existential resource. Journal of Personality and Social Psychology, 101, 638-652. 5 Abeyta, A. & Routledge, C. (2018). The need for meaning and religiosity: An individual differences approach to assessing existential needs and the relation with religious commitment, beliefs, and experiences. Personality and Individual Differences, 123, 6-13. 6 Koenig, H. G., McCullough, M.E., & Larson, D. B. (2001). Handbook of religion and health. New York: Oxford University Press. 7 https://www.census.gov/content/dam/Census/library/publications/2017/demo/p20-579.pdf 8 http://www.apa.org/news/press/releases/2017/08/lonely-die.aspx",2018,,,,,,,auto_seeded
ifsresearchbrief-clayroutledgefindingmeaning.pdf,"Research Brief May 2018 Meaning in Modern America by Clay Routledge Meaning is a fundamental psychological need. People who perceive their lives as full of meaning are physically and psychologically healthier than those who lack meaning. A lack of meaning is a risk factor for mental illness, suicide, and a wide range of unhealthy behaviors. When people are facing major life stressors and traumas, it is those who have a strong sense of purpose and meaning who are the most resilient. Individuals who view their lives as meaningful also live longer. In general, meaning motivates heathy, long-term goal pursuit and promotes psychological wellbeing.1 Relationships and religion have long been recognized as two particularly powerful sources of meaning in life. People who feel connected to and supported by others report greater meaning than those who feel disconnected, ostracized, or lonely.2 Experimental studies confirm this link by demonstrating that experiences of social exclusion decrease meaning3 whereas experiences that engender feelings of social support increase meaning.4 Concerning religion, believers and those who highly identify as religious tend to report greater perceptions of meaning than nonbelievers and those who believe but are not particularly religious.5 Religion has further been found to be a potent resource for defending against meaning threats; believers turn to their faith when confronted with situations that undermine a sense of meaning, and doing so helps protect psychological health.6 American culture is changing in a number of ways that have potentially powerful implications for people’s efforts to find and maintain meaning in life. Americans are waiting longer to get married and have children, and are having fewer children.7 Feelings of social disconnection and loneliness are on the rise, even as people are increasingly “connected” via social media.8 Americans are decreasingly religious both in terms of personal faith and 1 Hicks, J. & Routledge, C. (Eds) (2013). The experience of meaning in life: Classical perspectives, emerging themes, and controversies. New York: Springer Press. 2 Lambert, N. M., Stillman, T. F., Hicks, J. A., Kamble, S., Baumeister, R. F., & Fincham, F. D. (2013). To belong is to matter: Sense of belonging enhances meaning in life. Personality and Social Psychology Bulletin, 39, 1418-1427. 3 Stillman, T. F., Baumeister, R. F., Lambert, N. M., Crescioni, A., DeWall, N., Fincham, F. D. (2009). Alone and without purpose: Life loses meaning following social exclusion. Journal of Experimental Social Psychology, 45, 68-694. 4 Routledge C., Arndt, J., Wildschut, T., Sedikides, C., Hart, C., Juhl, J., Vingerhoets, A. J., & Scholtz, W. (2011). The past makes the present meaningful: Nostalgia as an existential resource. Journal of Personality and Social Psychology, 101, 638-652. 5 Abeyta, A. & Routledge, C. (2018). The need for meaning and religiosity: An individual differences approach to assessing existential needs and the relation with religious commitment, beliefs, and experiences. Personality and Individual Differences, 123, 6-13. 6 Koenig, H. G., McCullough, M.E., & Larson, D. B. (2001). Handbook of religion and health. New York: Oxford University Press. 7 https://www.census.gov/content/dam/Census/library/publications/2017/demo/p20-579.pdf 8 http://www.apa.org/news/press/releases/2017/08/lonely-die.aspx",2018,,,,,,,auto_seeded
ifsresearchbrief-religiousmarriageparadox2.pdf,"Research Brief December 2021 The Religious Marriage Paradox: Younger Marriage, Less Divorce By: Lyman Stone and Brad Wilcox The new marriage norm for American men and women is to marry around the age of 30, according to the U.S. Census. Many young adults believe that marrying closer to age 30 reduces their risk of divorce, and, indeed, there is research consistent with that belief. But we also have evidence suggesting that religious Americans are less likely to divorce even as they are more likely to marry younger than 30. This paradoxical pattern raises two questions worth exploring: Is the way religious Americans form their marriages different than the way marriages are formed by their more secular peers? And do religious marriages formed by twenty-somethings face different divorce odds than marriages formed by secular Americans in the same age group? The answer to that last question is complicated by the role of cohabitation in contemporary family formation. Today, more than 70% of marriages are preceded by cohabitation, as Figure 1 indicates. Increased cohabitation is both cause and consequence of the rise in the age at first marriage. But what most young adults do not know is that cohabiting before marriage, especially with someone besides your future spouse, is also associated with an increased risk of divorce, as a recent Stanford study reports. So, one reason that religious marriages in America may be more stable is that religion reduces young adults’ odds of cohabiting prior to marriage, even though it increases their likelihood of marrying at a relatively young age. Accordingly, in this Institute for Family Studies research brief, we explore the relationships between religion, cohabitation, age at marriage, and divorce by looking at data from the National Survey of Family Growth (NSFG).",2021,,,,,,,auto_seeded
ifsstrongfamiliesbetterstudentsresearchbrief-aug2022.pdf,"Research Brief August 2022 Strong Families, Better Student Performance: The More Things Change, The More They Remain the Same By: Nicholas Zill and Brad Wilcox As single -parent and stepparent families have become more common in the U.S., is it the case that children from these families have fewer problems than they used to? Many scholars believed that as alternative family types became more accep ted and less stigmatized, children from non -intact families would be less apt to exhibit learning, emotional, and behavior problems in school and elsewhere. Moreover, as government programs aimed at ameliorating the economic consequences of family instabil ity (i.e., Food Stamps,1 Medicaid, WIC,2 public housing, and child support enforcement) have grown, so, too, has the expectation that greater public support for vulnerable families would improve the life chances of children in single - parent families. More recently, educators have been under pressure from political leaders and social justice activists to make sure that their instructional and disciplinary practices do not contribute to unequal educational outcomes. In particular, advocates have criticiz ed schools for holding back lagging students from grade advancement and suspending or expelling students for serious misbehavior. Both interventions have tended to fall disproportionately upon children from non -intact families . These shifts in school discipline and pedagogy may have also minimized the consequences of family instability for children from single -parent and stepparent families in schools . In sum, it is possible that changes in the culture, public policy, and schooling have combined to make family instability less important for children’s school performance. On the other hand, hailing from an intact, married family may now be a greater ad vantage for children than ever. In a world marked by more electronic distractions, greater social atomization, and a more anemic community life, having the benefit of two, loving parents may be more valuable than it was even a quarter -century ago for our n ation’s children. Students’ performance and conduct in school are affected by the intellectual stimulation, emotional support, guidance, and discipline they receive at home. They are more likely to get the attention, affection, and direction they need to t hrive in school when they come from a family headed by their own married parents. This is especially true in a day and age when fathers in intact homes are more involved with their kids than ever before. As we have shown 1 Now called Supplementary Nutritional Assistance Program, or SNAP. 2 Women, Infants, and Children program.",2022,,,,,,,auto_seeded
