filename,title,year,document_type,primary_topics,policy_domain,geographic_scope,methodology,core_mechanisms,notes
in-pursuit-marriage-motherhood-and-womens-well-being-07-aug-25-2-1.pdf,"In Pursuit: Marriage, Motherhood, and Women’s Well -Being The Institute for Family Studies and The Wheatley Institute Jean M. Twenge Brad Wilcox Jenet Erickson August 2025 Wendy Wang",2025,,,,,,,auto_seeded
lymanstonefertilityhousingbrief-june.pdf,"More Crowding, Fewer Babies 1 © Copyright 2024 Institute for Family Studies and Gallup . All rights reserved. MORE CROWDING, FEWER BABIES: THE EFFECTS OF HOUSING DENSITY ON FERTILITY Lyman Stone June 2024",2024,,,,,,,auto_seeded
marriagestillmatters-final.pdf,1 Marriage Still Matters: Demonstrating the Link Between Marriage and Fertility in the 21st Century MARRIAGE STILL MATTERS Demonstrating the Link Between Marriage and Fertility in the 21st Century Lyman Stone and Spencer James October 2022,2022,,,,,,,auto_seeded
men-and-marriage-research-brief-1.pdf,"Men & Marriage: Debunking the Ball and Chain Myth W. Bradford Wilcox and Nicholas H. Wolfinger Return on Investment There’s no doubt that marriage requires sacrifices, and lots of them. Successful marriages require men to work harder, avoid cheating, spend less time with their friends, and make a good-faith eﬀort—day in and day out—to be emotionally present with their spouses. Being a good husband isn’t always easy. BUT IT TURNS OUT THAT THESE SACRIFICES PAY FOR THEMSELVES AND MORE.Marriage is not worth it for men. It’s not worth the practical and financial sacrifices, the lost romantic opportunities, or the “lack of freedom.” All in all, a spouse is a ball and chain—of little benefit to any man interested in pursuing happiness and well-being. Considering both the latest survey data and the continuing decline in the marriage rate, it’s fair to say that this viewpoint is becoming more entrenched in our society, particularly among younger men.1 But despite its prevalence, the ball and chain view of marriage is simply not supported by the research. Indeed, the benefits of marriage for men are substantial by every conceivable measure, including more money, a better sex life, and significantly better physical and mental health. Yet many men remain ignorant of these benefits, a view seemingly promoted by popular culture. .INTRODUCTION",,,,,,,,needs_review
obbbfamilypolicyfixesbrief-final-august2025.pdf,"August 2025 Beyond OBBB : Three Fixes for American Families Protect the Child Tax Credit, Increase Work Incentives, and Eliminate Family Discrimination Lyman Stone",2025,,,,,,,auto_seeded
successsequencedisadvantagedya-final.pdf,/T_he Power of the Success Sequence for Disadvantaged Young Adults 1 THE POWER OF THE SUCCESS SEQUENCE for Disadvantaged Young Adults Wendy Wang and Brad Wilcox May 2022,2022,,,,,,,auto_seeded
successsequencementalhealth-final-1.pdf,The Success Sequence and Millennial Mental Health: How following the sequence helps young adults flourish 1 THE SUCCESS SEQUENCE AND MILLENNIAL MENTAL HEALTH How following the sequence helps young adults /f_lourish Wendy R. Wang and Samuel T. Wilkinson September 2024,2024,,,,,,,auto_seeded
teensandtech-final-1.pdf,"Teens and Tech: What Difference Does Family Structure Make?1 Jean Twenge, Wendy Wang, Jenet Erickson, and Brad Wilcox October 2022 TEENS AND TECH What Diﬀerence Does Family Structure Make?",2022,,,,,,,auto_seeded
texaspolicyreport2024.pdf,"For the Sake of the Kids:Strengthening Families in the Lone Star StateCENTER ON HEALTH AND FAMILIES WRITTEN BY Brad Wilcox, Ph.D., Andrew C. Brown, J.D., Nicholas Zill, Ph.D., Nicholas Armstrong, Noah Torres, Caroline Welton, and Amylynn Smith September 2024",2024,,,,,,,auto_seeded
utah-family-miracle.pdf,A SUTHERLAND INSTITUTE & INSTITUTE FOR FAMILY STUDIES POLICY PUBLICATION The Utah Family Miracle: Five Policy Ideas to Keep Utah Families Strong and Stable,,,,,,,,needs_review
wfm-2017-fullreport.pdf,1 An International Report from Partners: UNIVERSIDAD DE PIURA (PERU) UNIVERSIDAD DE LA SABANA (COLOMBIA) INTERMEDIA CONSUL TING (ITALY)Co-Sponsor:ESSAY THE COHABITATION-GO-ROUND: COHABITATION AND FAMILY INSTABILITY ACROSS THE GLOBE MAPPING FAMILY CHANGE AND CHILD WELL-BEING OUTCOMESWORLD FAMILY MAP 2017,2017,,,,,,,auto_seeded
wheatleyifs-unprotectedreport-jan2024.pdf,wheatleyifs unprotectedreport jan2024,,,,,,,,needs_review
worldfamilymap-2019-051819final.pdf,An International Report from Co-sponsors: BAYLOR UNIVERSITY CARDUS THE IONA INSTITUTEWith generous support from: MAPPING FAMILY CHANGE AND CHILD WELL-BEING OUTCOMESWORLD FAMILY MAP 2019 THE TIES THAT BIND: Is Faith a Global Force for Good or Ill in The Family? and Essay Academic Partners: UNIVERSIDAD DE PIURA (PERU) UNIVERSIDAD DE LA SABANA (COLOMBIA) UNIVERSIDAD DE LOS ANDES (CHILE) NATIONAL TAIWAN UNIVERSITY UNIVERSIDAD PANAMERICANA (MEXICO),2019,,,,,,,auto_seeded
zill-ohio-cities-crime-poverty-brief.pdf,"IN CITIES WHERE SINGLE PARENTING IS THE NORM, CHILD POVERTY AND VIOLENT CRIME ARE HIGH Nicholas Zill October 14 , 202 4",,,,,,,,needs_review
zill-researchbrief-singleparentscollege.pdf,"Research Brief May 2020 For Getting Kids Through College, Single-Parent Families Are Not All the Same By: Nicholas Zill The 2020 senior classes in American high schools and colleges are graduating in a strange time. Virtual graduation ceremonies are replacing in-person gatherings out of fear of viral contagion. Graduates face a fall college semester full of uncertainties and a severely depressed job market. Many political figures continue to call for free college for everyone. Yet the cost of tuition and board is not the only obstacle to a student from a low-income or minority family getting into college and completing the coursework required to earn a bachelor’s degree. When open enrollment policies have been tried by colleges, large proportions of “at risk” students turned out to need remedial instruction, and few managed to graduate with a 4-year degree. When this has occurred, many have placed the blame on “poor performing” high schools and urged reforms to improve school efforts to prepare students for college. But those who seek to bolster achievement need to also pay attention to the role of families. Even without knowing anything about the specific high schools that a group of students have attended, one can do quite a good job of predicting which students will get college degrees and which ones will not. In fact, it is more informative to know about the family the student comes from, than the school to which he or she goes. Of course, it is also very helpful to know how well the student has done in high school in terms of grades and tested achievement. We tend to think of the various forms of single-parent families—those headed by separated or divorced mothers, never-married mothers, widowed mothers, or by fathers rather than mothers—as all alike, and all equally disadvantaged. And indeed, all these varieties of single-parent families do have lower average incomes than families with two married birth parents. Yet when it comes to putting kids through college, there are significant differences among these family forms. As shown below, children who grow up with a divorced or widowed mother are more likely to attend and graduate from a 4-year college than children who grow up with a separated or never-married mother, or with a separated, divorced, or never-married father. The reasons for the differences have partly to do with the characteristics of the women and men who wind up as divorced or widowed parents as opposed to separated or never-married parents, and with the financial and cultural circumstances in which children in these different family types are raised. But they also have to do with the continued participation of the non-resident parent in the child’s life, and the supports and safeguards that our social and legal institutions provide for some types of families but not others.",2020,,,,,,,auto_seeded
zillmentalhealthbrief.pdf,"FAMILIES MATTER TO KIDS’ MENTAL HEALTH Nicholas Zill March 4 , 202 4",,,,,,,,needs_review
