filename,title,year,document_type,primary_topics,policy_domain,geographic_scope,methodology,core_mechanisms,notes
1-24-texas-family-handbook.pdf,"A Pro-Family Handbook for Texas (Shaping Policy, Renewing Culture)",Patrick T. Brown (Ethics and Public Policy Center),2024-01,Report/Policy handbook,IFS x EPPC,State policy; family formation; marriage; fertility; education; youth well-being; tech-in-schools,"Policy priorities framed with polling + social-science claims (success sequence, marriage/fertility trends); state-level recommendations; written for policymakers & aligned stakeholders",Sensitivity: 'Pro-Family' framing can read ideological; references to abortion/fetal development + partisan identifiers in polling write-up need careful quoting in donor/board contexts,https://ifstudies.org/ifs-admin/resources/reports/1-24-texas-family-handbook.pdf
cohabitationreportapr2023-final.pdf,"What’s the Plan? Cohabitation, Engagement, and Divorce",Scott M. Stanley; Galena K. Rhoades,2023-04,Report/Research brief,IFS (relationship research),Cohabitation; engagement timing; divorce risk; relationship formation; 'sliding vs deciding',"Quantitative analysis using a national sample of first marriages (2010–2019), outcomes measured as of 2022; practical guidance section; aimed at educated lay + practitioners",Sensitivity: strong claims about cohabitation 'effect' and advice tone can be read as moralizing if excerpted; best to foreground methods/limitations and avoid culture-war packaging,https://ifstudies.org/ifs-admin/resources/reports/cohabitationreportapr2023-final.pdf
ifs-eppc-smartphonesappstoresbrief-nov23.pdf,"Making Smartphones and App Stores Safe for Kids: Federal, State, and Industry Measures",Clare Morell; Michael Toscano,2023-11,Policy brief,EPPC x IFS (Technology & Human Flourishing),Child online safety; device regulation; app stores; age verification; platform accountability,"Legal/policy landscape review + legislative/industry recommendations; written for lawmakers, regulators, advocates, and parents",Sensitivity: references pornography/social media harms + 'Big Tech incentives' language can read partisan; keep scholarly register when summarizing; distinguish what they recommend vs what evidence shows,https://ifstudies.org/ifs-admin/resources/briefs/ifs-eppc-smartphonesappstoresbrief-nov23.pdf
teensandtech-final-1.pdf,Teens and Tech: What Difference Does Family Structure Make?,Jean Twenge; Wendy Wang; Jenet Erickson; Brad Wilcox,2022-10,Report,IFS (family structure + youth outcomes),Family structure; teen mental health; screen time; parenting rules; social media policy,Survey-based analysis + appendix methods; connects family structure to tech use + teen outcomes; audience: policy/public + researchers,Sensitivity: family-structure comparisons can be read as stigmatizing single-parent households if not carefully framed; use their precise language + emphasize resources/support not blame,https://ifstudies.org/ifs-admin/resources/reports/teensandtech-final-1.pdf
marriagestillmatters-final.pdf,Marriage Still Matters: Demonstrating the Link Between Marriage and Fertility in the 21st Century,Lyman Stone; Spencer James,2022-10,Report,IFS x Wheatley Institute,Marriage; fertility; nonmarital births; cross-national comparisons; East Asia; OECD,Multi-method empirical approach: U.S. cohort patterns + OECD correlations + country-level fertility analysis; policy implications section; audience: policy + demography interested readers,Sensitivity: conclusion 'marriage still matters' can be heard as prescriptive; careful to separate descriptive findings from normative interpretations when used in interviews/donor language,https://ifstudies.org/ifs-admin/resources/reports/marriagestillmatters-final.pdf
