filename,title,year,document_type,primary_topics,policy_domain,geographic_scope,methodology,core_mechanisms,notes
1-24-texas-family-handbook.pdf,"A Pro-Family Handbook for TexasShaping Policy, Renewing Culture. Patrick T. Brown, Ethics and Public Policy Center",,,,,,,,needs_review
10-23-model-social-media-bill-summaryweb-2.pdf,"technology and human flourishing Protecting Kids Online: Legislative Summary Adam Candeub, Center for Renewing America Clare Morell, Ethics and Public Policy Center Michael Toscano, Institute for Family Studies Endorsed by the Family Policy AllianceShaping Policy, Renewing Culture. Summary In the past year, four states—Utah, Arkansas, Louisiana, and Texas—have passed social -media parental - consent laws based on ideas put forward in a joint report from the Ethics and Public Policy Center and In - stitute for Family Studies, titled “ Protecting Teens from Big Tech ” (August 2022). These laws have important differences. Some include requiring full parental access or certain parental tools, some limit certain features for minor accounts, and others provide expansive exemptions. The upshot of this is that some laws are strong - er than others. Evaluating the different provisions is important, as these laws are being challenged in court. In light of recent litigation and other states’ desires to pass similar laws, Clare Morell, Adam Candeub, and Michael Toscano have put together a model bill for states to use, drawing on aspects of Utah’s initial legisla - tion and incorporating key edits and provisions—based on the recent injunction against Arkansas’s law—to strengthen it against legal challenges. The underlying approach of their model bill—the same as the laws passed thus far—is to require (1) online platforms to age-verify their users in the respective state and (2) ob - tain parental consent for a minor to open or operate a social media account if a user is under the age of 18. The goal is to restore parental authority and rights over children’s online behavior. The Need for Legislation These laws are needed because parents are effective - ly powerless to oversee their children’s online behav - ior, and there is a collective nature to the harms of social media. First, parents need help. Even the best parental -control software available for purchase does not offer full protection. Apps like TikTok or Snapchat don’t provide access to such external controls, and certain app features, like Instagram’s direct messaging, are beyond a parent’s view. Given the lack of current requirements for age verification, a child can easily falsify his age and go behind his parents’ back to open social media accounts—or open secret secondary accounts of which parents are unaware. For parents to effectively oversee their children’s online behavior, meaningful age verifica - tion and parental consent over social media account formation are necessary. Second, the collective na - ture of the harms of social media necessitates public - policy solutions. Individual parents are powerless against mammoth Big Tech companies and face",2022,,,,,,,auto_seeded
10-23-model-social-media-billweb.pdf,"technology and human flourishing Model Legislation for Age Verification of Social Media Adam Candeub, Center for Renewing America Clare Morell, Ethics and Public Policy Center Michael Toscano, Institute for Family Studies Endorsed by the Family Policy FoundationShaping Policy, Renewing Culture. Part 1. General Requirements Section 101. Definitions. As used in this chapter: (1) “Account holder” means a person who has, or opens, an account or profile to use a social media compa - ny’s platform. (2) (a) “Interactive computer service” means an information service, information system, or informa - tion access software provider that: (i) provides or enables computer access by multiple users to a computer server; and (ii) provides access to the Internet. (b) “Interactive computer service” includes: (i) a web service; (ii) a web system; (iii) a website; (iv) a web application; or, (v) a web portal. (3) “Minor” means an individual who is under the age of 18. (4) “Device setting” means an adjustment in a program or hardware device that changes it to the user’s preference. (5) “Post” means content that an account holder makes available on a social media platform for other ac - count holders or users to view. (6) “Social media company” means a person or entity that:",,,,,,,,needs_review
20241122134105177finalsocial-science-scholars-amicus-brief.pdf,"No. 23-1122 In the Supreme Court of the United States _______________ FREE SPEECH COALITION , INC., ET AL., Petitioner s, v. KEN PAXTON , ATTORNEY GENERAL OF TEXAS , Respondent . _______ On Writ of Certiorari to the United States Court of Appeals for the Fifth Circuit ______________ BRIEF OF SOCIAL SCIENCE SCHOLA RS AS AMIC I CURIAE IN SUPPORT OF RESPONDENT _______________ JONATHAN BERRY JAMES R. CONDE Counsel of Record ADAM H CHAN BOYDEN GRAY PLLC 800 Connecticut Ave. NW, Suite 900 Washington, DC 20006 (202) 955-0620 jconde@boydengray.com",,,,,,,,needs_review
2final-ifs-homesforyoungfamilies-apartments-09-30-25.pdf,September 2025 Homes for Young Families Part 2 Americans Are Willing to Pay for Family -Friendly Apartments Lyman Stone Bobby Fijan,2025,,,,,,,auto_seeded
5th-circuit-age-verification-ruling.pdf,"technology and human flourishing Vindication by the Fifth Circuit Court of AppealsShaping Policy, Renewing Culture. On March 8, 2024, the U.S. Court of Appeals for the Fifth Circuit upheld a Texas law requiring age veri - fication measures to guard the state’s kids from por - nography sites. The decision is a major win for the children of the Lone Star State. It also represents a vindication of the policy work of scholars from the Center for Renewing America , the Ethics and Pub - lic Policy Center , and the Institute for Family Studies , who have fought a David -and -Goliath battle against powerful interests to see such laws enacted through - out the country. In August 2022, scholars from these three organi - zations published a joint policy brief titled, “ Protect - ing Teens from Big Tech: Five Policy Ideas for States.” The overarching objective of this brief was to provide legislative strategies to states seeking to protect chil - dren online and empower parents. Because of the inaction of Congress and some misguided rulings by the Supreme Court—decided long before social media and smartphones were invented—social me - dia platforms and pornography sites have been free to addict America’s children and expose them to ob - scene content with impunity, all of which has fostered a mental health crisis among adolescents on a histor - ic scale. The brief encouraged states to take action to protect children, rather than wait for the breaking of Congressional gridlock, and gave guidance for how states could do this effectively and constitutionally. The very first policy idea that our scholars proposed was to require age -verification for pornography sites and age-verification with parental consent for social media platforms. In 2023, nearly a dozen states im - plemented one or both of these measures. In 2024, by some counts , more than a dozen additional states are considering following their example. But these efforts have not come without challenge. Lobbyists representing Big Tech and Big Porn, aid - ed by the American commentariat, have been fiercely contesting these laws throughout the country, with an undue confidence that courts would find them unconstitutional. These gargantu - an companies have taken a shock and awe approach, suing every such law passed, trying to scare states away from taking action or causing them to second guess the underlying logic of their bills. From the beginning of this ef - fort, the scholars of the Center for Renewing America, the Ethics and Public Policy Center, and the Institute for Family Studies have maintained that judicial prece - dent only superficially weighed against these measures. A closer analysis of the rele - vant rulings shows that the underlying factual pred - icates upon which these decisions relied have been radically undermined by advances in technology, and, therefore, the precedents are ripe for revisiting. Our scholars have always maintained that the implementation of these laws was going to entail a ferocious battle, but that it was one that states could ultimately win. Therefore, we were vindicated and overjoyed, but not surprised, when the Fifth Circuit Court of Appeals ruled the fol lowing : Applying rational-basis review, the age -verification requirement is rationally related to the govern - ment’s legitimate interest in preventing minors’ access to pornography. . . . Therefore, the age - verification requirement does not violate the First Amendment. We believe that the logic of this ruling can also be ap - plied to age -verification for social media platforms. With this decision, we strongly encourage lawmak - ers in more states to adopt these types of laws, and prepare to fight for them all the way up to the Su - preme Court. What we are striving for is nothing less than the heart and soul of America’s children.",2024,,,,,,,auto_seeded
atlanta-report.pdf,RENEWING MARRIAGE & THE AMERICAN DREAM Georgia Center for Opportunity 2015 / 2016 Baseline Report BENEFITS MARRIAGE,2016,,,,,,,auto_seeded
cohabitationreportapr2023-final.pdf,"What’s the Plan? Cohabitation, Engagement, and Divorce by Scott M. Stanley & Galena K. Rhoades APRIL 2023",2023,,,,,,,auto_seeded
dividedstatereport-final102121.pdf,"1 The Divided State of Our Unions: Family Formation in (Post-)COVID-19 America /T_he Wheatle y Institution FAMILY FORMATION IN /parenleft.capPOST/hyphen.cap/parenright.capCOVID/hyphen.cap/one.LP/nine.LP AMERICA The Divided State of Our Unions BRAD WILCOX, WENDY WANG, JASON CARROLL, AND LYMAN STONEOctober 2021",2021,,,,,,,auto_seeded
family-structure-index-summary (1).pdf,"1 36 47 44 42 22 19 2 5 25 49 9 11 33 31 15 40 50 48 45 28 12 6 3 4 7 10 8 18 14 43 37 26 39 35 27 21 17 32 13 20 16 41 24 38 29 34 48 30 23 famil y structure index map of overall ranking by stateWhat is the Family structure Index? The Family Structure Index is a measure of the most important family structure trends in the US, focusing on each state’s share of adult residents who are married, have children, and raise those children together through their high-school years. hoW Was the Index calculated? The index was calculated for each state by: 1) The percentage of married adults aged 25 to 54, 2) The average number of lifetime births per woman. 3) The percentage of children aged 15 to 17 who are living with their married parents. What does the Index score mean? Index scores higher than 60 indicate that the state is above the national average in at least one of the components. Index scores lower than 60 mean the state is below average in at least one area. read the full report at: CCV.org/FamilyIndex",,,,,,,,needs_review
family-structure-index-summary.pdf,"1 36 47 44 42 22 19 2 5 25 49 9 11 33 31 15 40 50 48 45 28 12 6 3 4 7 10 8 18 14 43 37 26 39 35 27 21 17 32 13 20 16 41 24 38 29 34 48 30 23 famil y structure index map of overall ranking by stateWhat is the Family structure Index? The Family Structure Index is a measure of the most important family structure trends in the US, focusing on each state’s share of adult residents who are married, have children, and raise those children together through their high-school years. hoW Was the Index calculated? The index was calculated for each state by: 1) The percentage of married adults aged 25 to 54, 2) The average number of lifetime births per woman. 3) The percentage of children aged 15 to 17 who are living with their married parents. What does the Index score mean? Index scores higher than 60 indicate that the state is above the national average in at least one of the components. Index scores lower than 60 mean the state is below average in at least one area. read the full report at: CCV.org/FamilyIndex",,,,,,,,needs_review
final-andersonstone-ifspaidfamilyleavepolicybrief.pdf,"Policy Brief May 2020 A Child-Focused Paid Parental Leave Policy for the U.S. By: Rachel Anderson and Lyman Stone Executive Summary A highly contagious coronavirus has led communities to shutter businesses, schools, and public places, requiring families to undertake multiple roles at once: caregivers, educators, and workers. As our society relies on the health and capability of families right now, policymakers should consider future measures that strengthen families, particularly in their childrearing role. Prior to and during the COVID-19 crisis, politicians on both sides of the aisle recognized the need for a better family leave policy in America. In March, Congress secured emergency paid leave policy for families affected by COVID-19, including the closure of hundreds of thousands of schools and places of childcare. Once the crisis subsides, policymakers should look again at more permanent approaches to providing paid family leave. Family leave policies can be structured in widely divergent ways and aimed at very different ends. With a proliferation of proposals, it is vital that policymakers make evidence-based decisions with clear pathways to implementation and reasonable expectations of achieving specific policy outcomes. In order to have a family leave policy that fits such a demanding criteria, it is important to first survey existing literature to identify the range of effects that policymakers might expect to see from an expansion in paid family leave. This paper does so with a focus on paid parental leave, a topic that has garnered a sizeable body of research. Across the academic literature on family leave policies, especially maternity or paternity leave for new children, a variety of outcomes have been identified. There are four kinds of policy outcomes from family leave that are the focus of this report as they are of interest to policymakers and well-identified in academic research: improvements in child welfare and health, increases in achievement of fertility desires, increases in parental connection to gainful employment, and improvements in marital stability. In general, parental leave benefits provided in the first weeks of a child’s life have been most clearly shown to benefit child health and maternal attachment to work, with more mixed proof for impacts on marital stability, parental employment, and fertility achievement.",2020,,,,,,,auto_seeded
final-ifs-eppc-protectingteensfrombigtech-aug2022.pdf,PROTECTING TEENS FROM BIG TECH Five Policy Ideas for States Clare Morell Adam Candeub Jean Twenge Brad Wilcox August 2022,2022,,,,,,,auto_seeded
final-ifs-protestantfamilyethicreport.pdf,"1 The Protestant Family Ethic: What Do Protestant, Catholic, Private, and Public Schooling Have to Do with Marriage, Divorce, and Non-marital Childbearing? Albert Cheng Patrick J. Wolf Wendy Wang W. Bradford WilcoxBy: The Protestant Family Ethic: What Do Protestant, Catholic, Private, and Public Schooling Have to Do with Marriage, Divorce, and Non-marital Childbearing?",,,,,,,,needs_review
final-ifs-two-parentfamilybrief-9-20-23-2.pdf,"Do Two Parents Matter More Than Ever? 1 © Copyright 2023 Institute for Family Studies. All rights reserved. DO TWO PARENTS MATTER MORE THAN EVER? College Graduation & Economic Success More Common for Young Adults From Intact Families Brad Wilcox, Wendy Wang, Spencer James, and Thomas Murray September 20, 2023",2023,,,,,,,auto_seeded
final-ifsparentsreport-1.pdf,"1 Research Brief August 2021 Homeward Bound: The Work-Family Reset in Post-COVID America By: Wendy Wang and Jenet Erickson Editor’s Note: This report is co-sponsored by The Wheatley Institution. Despite all the chaos and struggles over the past year, the fallout from the COVID-19 pandemic gave many parents the first-hand experience of working from home. And they like it. Indeed, the possibilities in workplace flexibility created during the coronavirus crisis may have begun a reset in the way parents think about what they want in their work and family lives—a reset that looks “homeward bound.” More than half of parents with children under age 18 said that COVID-19 has made them more likely to prefer working from home, either most of the time (33%) or half of the time (20%), according to a new Institute for Family Studies/Wheatley Institution survey by YouGov. These feelings are shared by both mothers and fathers. Over half of fathers said the coronavirus pandemic has made them more likely to prefer working from home (either full or part time), while only 38% said that the impact of COVID-19 made them more likely to want to work from the office. Similarly, only 30% of mothers said the pandemic made them more likely to prefer working from the office most of the time. A majority (53%) of mothers would prefer to work from home most or half of the time. This question was asked of parents who said that their ideal situation was to work. The rest of the parents (18% of moms and 8% of dads) said they simply prefer to not work for pay at all. 313422193830020406080100FathersMothersFrom home most of timeFrom home half of timeFrom office most of timeWorkingfrom home is the preferred arrangement for parents after COVID-19% saying COVID-19 has madethem more likely to prefer... Notes:Based on adults ages 18 to 55 with children under age 18. Results for those who prefer not working for pay at all are not shown.Source: IFS/Wheatley Institution family survey, May-June 2021.",2021,,,,,,,auto_seeded
final-ifsresearchbrief-ayers-evangelicalsandsex8819.pdf,"Research B rief August 2019 Current Sexual Practices of Evangelical Teens and Young Adults By: David J. Ayers Evangelicals1 have historically held a simple view of sex outside of marriage —don’t . Yet social science has shown for years that most self -identified Evangelicals engage in premarital sex. Despite the official teachings of their churches and clear instruction in the Bi ble, sex outside of marriage has become increasingly morally acceptable among them as well. For example, in the General Social Survey (GSS), in 2014 through 2018 combined, only 37% of “fundamentalist”2 adults said that sex outside marriage was “always wr ong,” while 41% said it was “not wrong at all.” From 1974 -1978, the same percentages were 44% and 27%, respectively. Meanwhile, the GSS showed that among never -married fundamentalist adults between 2008 and 2018, 86% of females had at least one male sex pa rtner since age 18, while 57% had three or more. For males, 82% had had at least one sex partner, and 65% had three or more. This includes respondents as young as 18 or 19, which reduces the percentages who are sexually active, because percentages rise as singles get older. In a previous analysis of 2000 -2016 GSS data for never -married members of conservative Protestant denominations who were 25 -40 years of age, I found that 89% of men and 92% of women had at least one opposite -sex partner in the past five years.3 The wholesale abandonment of most of the traditional sex ethic among modern Evangelicals is well -documented.4 Josh ua Harris is, of course , the most recent example. As Dale Kuehne 1 By the term ‘Evangelical’ I am referring specifically to Protestants who embrace the following core beliefs: “the Bible is the inspired, infallible and authoritative Word of God; classical doctrines on the Trinity; the virgin birth, perfect life, miracles, atoning dea th, physical resurrection, ascension to the right hand of the Father and personal return in power and glory of Jesus Christ; the lost and sinful state of all human beings, who can only be saved through by being ‘born again through faith in Christ alone’; t he work of that same Holy Spirit in the lives of all true believers; the resurrection of all humankind to either eternal life or eternal damnation; the spiritual unity of all true believers in Christ; the need to personally share with unbelievers their nee d to trust in Christ, to accept the free gift of salvation and the forgiveness of sins accomplished by his death on the cross.” Note that this is consistent with the National Association of Evangelicals understanding of this term, and what denominations wh o are part of the NAE generally embrace. 2 “Fundamentalist” and “conservative Protestant” in the GSS both match typical understandings of “Evangelical.” 3 See Ayers, David J. Christian Marriage: A Comprehensive Introduction (Bellingham: Lexham Press, 2018), page 68. 4 See ibid. See also Mark Regnerus’ excellent Forbidden Fruit: Sex & Religion in the Lives of American Teenagers (New York: Oxford University Press, 2009).",2019,,,,,,,auto_seeded
final-ifstechmarriageresearchbrief.pdf,"More Scrolling, More Marital Problems 1 © Copyright 2023 Institute for Family Studies. All rights reserved. MORE SCROLLING, MORE MARITAL PROBLEMS Less sex, more divorce worries for couples distracted by phones Wendy Wang and Michael Toscano July 10, 2023",2023,,,,,,,auto_seeded
final-teenquarantine2020.pdf,"1 Teens in Quarantine: Mental Health, Screen Time, and Family Connection Jean M. Twenge Sarah M. Coyne Jason S. Carroll W. Bradford WilcoxBy: Teens in Quarantine: Mental Health, Screen Time, and Family Connection 2020",2020,,,,,,,auto_seeded
final2-ifs-single-americansbrief2020.pdf,"1 Research Brief Sept. 2020 More Than One -third of Prime -age Americans Have Never Married By: Wendy Wang America is the middle of two simultaneous trends related to marriage. Marriages today are more stable, thanks to the steady decline of divorce rates since the 1980s. At the same time, however, a declining share of Americans marry. In 2018, a record 35% of Americans ages 25 to 50, or 39 million, had never been married, according to a new Institute for Family Studies (IFS) analysis of U.S. Census data. The share was only 9% in 1970. Previous research suggest s that marriage rates tend to fall during a recession. With the Covid -19 stay -at-home order, and the financial fallout from the pandemic, we are most likely to see the share of never -married adults break new records in the near future. Many factors are related to the rise of never -marrieds. Young adults have taken their time to enter marriage. The median age for first -time marriages today is 28 for women and 30 for men. Back in 1970, Americans typically got married in their early 20s. Also, young adults today often live with their partner before getting married. Cohabitation is seen as an alternativ e living arrangement for couples, even if they do not plan to get married. Share of never -married adults reaches new high Notes : Based on adults ages 25 -50. A small share of widowed adults is not shown. Source: U.S. Census and American Community Survey, IPUMS . 91319212935 0306090 1970 1980 1990 2000 2010Curently married Never married% 2018Divorced or separated",2020,,,,,,,auto_seeded
for-better-four-proven-ways-to-a-strong-and-stable-marriage-4.pdf,For Better: Four Proven Ways to A Strong And Stable Marriage The Institute for Family Studies and The Wheatley Institute Jeffrey Dew Brad Wilcox Jason Carroll February 2025,2025,,,,,,,auto_seeded
futureforthefamiliesreport-feb2025.pdf,February 2 025 A Future for the Family: A New Technology Agenda for the Right Michael Toscano Clare Morell Brad Littlejohn Jon Askonas Emma Waters,,,,,,,,needs_review
hope-and-a-future-spreads-1.pdf,hope and a future spreads 1,,,,,,,,needs_review
ifs-congress-familypriorities-final.pdf,Five Pro-Family Priorities for the 118th Congress and Beyond Policies and Public Opinion on Putting Families First by Patrick T. Brown FEBRUARY 2023,2023,,,,,,,auto_seeded
ifs-eppc-ageverificationpolicybrief.pdf,"AGE VERIFICATION Policy Ideas for States John Ehrett Clare Morell June 13, 2023",2023,,,,,,,auto_seeded
ifs-eppc-smartphonesappstoresbrief-nov23.pdf,"technology and human flourishing Making Smartphones and App Stores Safe for KidsShaping Policy, Renewing Culture. Federal, State, and Industry Measures About the Authors Clare Morell is a Senior Policy Analyst at the Ethics and Public Policy Center, where she directs the Technology and Human Flourishing Project. Michael Toscano is executive director of the Institute for Family Studies. Acknowledgements The authors would like to thank Adam Candeub, Chris McKenna, Eleanor Gaetan, Lisa Thompson, Lina Nealon, Marcel Van der Watt, and Joel Thayer for their review and helpful comments on this brief, as well as Elizabeth Self for her support of this effort at several stages. They would also like to thank Emma Fuentes, Chris McCaffery, Alysse ElHage Watson, and Allie Bullivant for their assistance in producing it. Above all, many thanks to Melissa McKay, a loving mother whose desire and work to protect her own kids inspired many of the ideas contained within. Endorsements The National Center on Sexual Exploitation (NCOSE) Protect Young Eyes (PYE )",,,,,,,,needs_review
ifs-eppc-sunbeltfamilypolicypriorities-final-1.pdf,"Pro-Family Policy Priorities for StatesShaping Policy, Renewing Culture. Polling and Perspectives from the Sun Belt Patrick T. Brown, Ethics and Public Policy Center Brad Wilcox, Institute for Family Studies",,,,,,,,needs_review
ifs-gallup-marriagewellbeingbrief-feb9.pdf,"MARRIED PEOPLE ARE LIVING THEIR BEST LIVES Jonathan Rothwell FEBRUARY 9, 202 4",,,,,,,,needs_review
ifs-gallup-parentingsocialmediascreentime-october2023-1.pdf,"HOW PARENTING AND SELF -CONTROL MEDIATE THE LINK BETWEEN SOCIAL MEDIA USE AND YOUTH MENTAL HEALTH Jonathan Rothwell October 11, 2023",2023,,,,,,,auto_seeded
ifs-globalcohabbrief-final-1.pdf,"Less Stable, Less Important: Cohabiting Families’ Comparative Disadvantage Across the Globe Wendy Wang and W. Bradford WilcoxBy",,,,,,,,needs_review
